{
  "$schema": "https://json-schema.org/draft/2020-12/schema",
  "$id": "robinhood-batch.schema.json",
  "title": "WoolFi Robinhood coordinated deployment",
  "type": "object",
  "required": ["chainId", "nonAtomicTransactionsAcknowledged", "seedSet", "core", "defaultRisk", "defaultSafety", "gates", "assets", "pools"],
  "properties": {
    "$schema": {"type": "string"},
    "$schemaVersion": {"const": 1},
    "chainId": {"const": 4663},
    "nonAtomicTransactionsAcknowledged": {"type": "boolean"},
    "seedSet": {
      "description": "Pools that receive initial seed liquidity. All 18 pools are still deployed and initialized; the rest start with zero liquidity.",
      "type": "array",
      "minItems": 1,
      "uniqueItems": true,
      "items": {"enum": ["mstr-usdg", "coin-usdg", "crcl-usdg", "nvda-usdg", "spy-usdg", "gld-usdg", "aapl-usdg", "tsla-usdg", "mstr-weth", "coin-weth", "qqq-weth", "nvda-weth", "pltr-weth", "aapl-msft", "spy-nvda", "spy-qqq", "gld-slv", "weth-usdg"]}
    },
    "core": {
      "type": "object",
      "required": [
        "poolManager", "stakingToken", "hook", "positionManager", "governor", "swapRouter",
        "rebateDistributor", "liquidityZapper", "poolAligner", "timelock", "externalSwapExecutor", "urufuNft", "multisig",
        "treasury", "rebalancer", "treasuryFeeSink", "marketHours", "sequencerUptimeFeed",
        "sequencerGracePeriod", "totalTreasuryAllocationCap"
      ],
      "additionalProperties": false,
      "properties": {
        "poolManager": {"$ref": "#/$defs/address"},
        "stakingToken": {"$ref": "#/$defs/address"},
        "hook": {"$ref": "#/$defs/address"},
        "positionManager": {"$ref": "#/$defs/address"},
        "governor": {"$ref": "#/$defs/address"},
        "swapRouter": {"$ref": "#/$defs/address"},
        "rebateDistributor": {"$ref": "#/$defs/address"},
        "liquidityZapper": {"$ref": "#/$defs/address"},
        "poolAligner": {"$ref": "#/$defs/address"},
        "timelock": {"$ref": "#/$defs/address"},
        "externalSwapExecutor": {"$ref": "#/$defs/address"},
        "urufuNft": {"$ref": "#/$defs/address"},
        "multisig": {"$ref": "#/$defs/address"},
        "treasury": {"$ref": "#/$defs/address"},
        "rebalancer": {"$ref": "#/$defs/address"},
        "treasuryFeeSink": {"$ref": "#/$defs/address"},
        "marketHours": {"$ref": "#/$defs/address"},
        "sequencerUptimeFeed": {"$ref": "#/$defs/address"},
        "sequencerGracePeriod": {"type": "integer", "minimum": 0},
        "totalTreasuryAllocationCap": {"type": "integer", "minimum": 0}
      }
    },
    "defaultRisk": {"$ref": "#/$defs/risk"},
    "defaultSafety": {"$ref": "#/$defs/safety"},
    "gates": {"$ref": "#/$defs/gates"},
    "assets": {
      "type": "object",
      "minProperties": 14,
      "maxProperties": 14,
      "additionalProperties": {"$ref": "#/$defs/asset"}
    },
    "pools": {
      "type": "array",
      "minItems": 18,
      "maxItems": 18,
      "items": {"$ref": "#/$defs/pool"}
    }
  },
  "additionalProperties": false,
  "$defs": {
    "address": {"type": "string", "pattern": "^0x[0-9a-fA-F]{40}$"},
    "asset": {
      "type": "object",
      "required": ["token", "oracle", "feed", "heartbeat", "oracleKind"],
      "additionalProperties": false,
      "properties": {
        "token": {"$ref": "#/$defs/address"},
        "oracle": {"$ref": "#/$defs/address"},
        "feed": {"$ref": "#/$defs/address"},
        "heartbeat": {"type": "integer", "minimum": 0},
        "oracleKind": {"enum": ["stock-pause-guarded", "chainlink"]}
      }
    },
    "safety": {
      "type": "object",
      "required": ["stabilizationSeconds", "maxOracleSkew"],
      "additionalProperties": false,
      "properties": {
        "stabilizationSeconds": {"type": "integer", "minimum": 0},
        "maxOracleSkew": {"type": "integer", "minimum": 0}
      }
    },
    "gates": {
      "type": "object",
      "required": [
        "auditComplete", "multisigApproved", "uruCapsApproved", "oraclesVerified",
        "initialLiquidityApproved", "keeperReady", "indexerReady", "frontendReviewed"
      ],
      "additionalProperties": false,
      "properties": {
        "auditComplete": {"type": "boolean"},
        "multisigApproved": {"type": "boolean"},
        "uruCapsApproved": {"type": "boolean"},
        "oraclesVerified": {"type": "boolean"},
        "initialLiquidityApproved": {"type": "boolean"},
        "keeperReady": {"type": "boolean"},
        "indexerReady": {"type": "boolean"},
        "frontendReviewed": {"type": "boolean"}
      }
    },
    "risk": {
      "type": "object",
      "required": [
        "tickSpacing", "kScaled", "baseFeeBps", "toleranceBps", "hardThresholdBps",
        "drawdownBps", "vaultFeeBps", "treasuryFeeBps"
      ],
      "additionalProperties": false,
      "properties": {
        "tickSpacing": {"type": "integer", "minimum": 1},
        "kScaled": {"type": "integer", "minimum": 1},
        "baseFeeBps": {"type": "integer", "minimum": 1, "maximum": 10000},
        "toleranceBps": {"type": "integer", "minimum": 1, "maximum": 10000},
        "hardThresholdBps": {"type": "integer", "minimum": 1, "maximum": 10000},
        "drawdownBps": {"type": "integer", "minimum": 1, "maximum": 10000},
        "vaultFeeBps": {"type": "integer", "minimum": 1, "maximum": 10000},
        "treasuryFeeBps": {"type": "integer", "minimum": 1, "maximum": 10000}
      }
    },
    "pool": {
      "type": "object",
      "required": ["slug", "base", "quote", "hoursPolicy", "sqrtPriceX96", "vaultAllocationCap"],
      "additionalProperties": false,
      "properties": {
        "slug": {"type": "string", "minLength": 1},
        "base": {"type": "string", "minLength": 1},
        "quote": {"type": "string", "minLength": 1},
        "hoursPolicy": {"enum": ["equity-hours", "always-open"]},
        "sqrtPriceX96": {"type": "integer", "minimum": 0},
        "vaultAllocationCap": {"type": "integer", "minimum": 0},
        "risk": {"$ref": "#/$defs/risk"},
        "safety": {"$ref": "#/$defs/safety"},
        "initialLiquidity": {
          "type": "object",
          "required": ["base", "quote", "slippageBps"],
          "additionalProperties": false,
          "properties": {
            "base": {"type": "integer", "minimum": 0},
            "quote": {"type": "integer", "minimum": 0},
            "slippageBps": {"type": "integer", "minimum": 0, "maximum": 1000},
            "minShares": {"type": "integer", "minimum": 0}
          }
        }
      }
    }
  }
}
