{
  "$schema": "./robinhood-batch.schema.json",
  "$schemaVersion": 1,
  "chainId": 4663,
  "nonAtomicTransactionsAcknowledged": false,
  "seedSet": [
    "weth-usdg",
    "nvda-usdg"
  ],
  "core": {
    "poolManager": "0x8366a39cc670b4001a1121b8f6a443a643e40951",
    "stakingToken": "0x9fbe210007ddd8389f98d0253018e65cc48b9d24",
    "hook": "0x0000000000000000000000000000000000000000",
    "positionManager": "0x0000000000000000000000000000000000000000",
    "governor": "0x0000000000000000000000000000000000000000",
    "swapRouter": "0x0000000000000000000000000000000000000000",
    "rebateDistributor": "0x0000000000000000000000000000000000000000",
    "liquidityZapper": "0x0000000000000000000000000000000000000000",
    "poolAligner": "0x0000000000000000000000000000000000000000",
    "timelock": "0x0000000000000000000000000000000000000000",
    "externalSwapExecutor": "0xCaf681a66D020601342297493863E78C959E5cb2",
    "urufuNft": "0x60cb7082c8c14b4237c6a24c65e7c2e7abe2bd17",
    "multisig": "0x0000000000000000000000000000000000000000",
    "treasury": "0x0000000000000000000000000000000000000000",
    "rebalancer": "0x0000000000000000000000000000000000000000",
    "treasuryFeeSink": "0x0000000000000000000000000000000000000000",
    "marketHours": "0x0000000000000000000000000000000000000000",
    "sequencerUptimeFeed": "0x0000000000000000000000000000000000000000",
    "sequencerGracePeriod": 0,
    "totalTreasuryAllocationCap": 0
  },
  "defaultRisk": {
    "tickSpacing": 60,
    "kScaled": 40000,
    "baseFeeBps": 30,
    "toleranceBps": 500,
    "hardThresholdBps": 1500,
    "drawdownBps": 2000,
    "vaultFeeBps": 2000,
    "treasuryFeeBps": 1500
  },
  "defaultSafety": {
    "stabilizationSeconds": 900,
    "maxOracleSkew": 0
  },
  "gates": {
    "auditComplete": false,
    "multisigApproved": false,
    "uruCapsApproved": false,
    "oraclesVerified": false,
    "initialLiquidityApproved": false,
    "keeperReady": false,
    "indexerReady": false,
    "frontendReviewed": false
  },
  "assets": {
    "MSTR": {"token": "0xec262a75e413fafd0df80480274532c79d42da09", "oracle": "0x0000000000000000000000000000000000000000", "feed": "0x396118bdfb181e6240e74d243f266b061c0edc3d", "heartbeat": 86400, "oracleKind": "stock-pause-guarded"},
    "COIN": {"token": "0x6330d8c3178a418788df01a47479c0ce7ccf450b", "oracle": "0x0000000000000000000000000000000000000000", "feed": "0xa3a468a452940b7d6b69991207b508c609a98ef2", "heartbeat": 86400, "oracleKind": "stock-pause-guarded"},
    "CRCL": {"token": "0xdf0992e440dd0be65bd8439b609d6d4366bf1cb5", "oracle": "0x0000000000000000000000000000000000000000", "feed": "0x6652edf64ba3731c4f2d3ce821a0fb1f1f6b482a", "heartbeat": 86400, "oracleKind": "stock-pause-guarded"},
    "NVDA": {"token": "0xd0601ce157db5bdc3162bbac2a2c8af5320d9eec", "oracle": "0x0000000000000000000000000000000000000000", "feed": "0x379ec4f7c378f34a1b47e4f3cbebcbac3e8e9f15", "heartbeat": 86400, "oracleKind": "stock-pause-guarded"},
    "SPY": {"token": "0x117cc2133c37b721f49de2a7a74833232b3b4c0c", "oracle": "0x0000000000000000000000000000000000000000", "feed": "0x319724394d3a0e3669269846abe664cd621f9f6a", "heartbeat": 86400, "oracleKind": "stock-pause-guarded"},
    "GLD": {"token": "0xc9a981fee1f9dec688bb123ccdecc63d0debfc4e", "oracle": "0x0000000000000000000000000000000000000000", "feed": "0x470a51258068043bd43dc0a56245625c9fe86eb0", "heartbeat": 86400, "oracleKind": "stock-pause-guarded"},
    "WETH": {"token": "0x0bd7d308f8e1639fab988df18a8011f41eacad73", "oracle": "0x0000000000000000000000000000000000000000", "feed": "0x78f3556b67e17df817d51ef5a990cdaf09e8d3a9", "heartbeat": 86400, "oracleKind": "chainlink"},
    "USDG": {"token": "0x5fc5360d0400a0fd4f2af552add042d716f1d168", "oracle": "0x0000000000000000000000000000000000000000", "feed": "0x61b7e5650328764b076a108eff5fa7282a1b9ad2", "heartbeat": 86400, "oracleKind": "chainlink"},
    "QQQ": {"token": "0xd5f3879160bc7c32ebb4dc785f8a4f505888de68", "oracle": "0x0000000000000000000000000000000000000000", "feed": "0x80901d846d5d7b030f26b480776ee3b29374c2ae", "heartbeat": 86400, "oracleKind": "stock-pause-guarded"},
    "PLTR": {"token": "0x894e1ec2d74ffe5aef8dc8a9e84686accb964f2a", "oracle": "0x0000000000000000000000000000000000000000", "feed": "0x820abedff239034956b7a9d2f0a331f9f075eb4c", "heartbeat": 86400, "oracleKind": "stock-pause-guarded"},
    "AAPL": {"token": "0xaf3d76f1834a1d425780943c99ea8a608f8a93f9", "oracle": "0x0000000000000000000000000000000000000000", "feed": "0x6b22a786baa607d76728168703a39ea9c99f2cd0", "heartbeat": 86400, "oracleKind": "stock-pause-guarded"},
    "MSFT": {"token": "0xe93237c50d904957cf27e7b1133b510c669c2e74", "oracle": "0x0000000000000000000000000000000000000000", "feed": "0x45c3c877c15e6ba2ebb19ea114ea508d14c1af2e", "heartbeat": 86400, "oracleKind": "stock-pause-guarded"},
    "TSLA": {"token": "0x322f0929c4625ed5bad873c95208d54e1c003b2d", "oracle": "0x0000000000000000000000000000000000000000", "feed": "0x4a1166a659a55625345e9515b32adecea5547c38", "heartbeat": 86400, "oracleKind": "stock-pause-guarded"},
    "SLV": {"token": "0x411efb0e7f985935daec3d4c3ebaea0d0ad7d89f", "oracle": "0x0000000000000000000000000000000000000000", "feed": "0x209b73908e92ae021826ed79609845451ecba2ce", "heartbeat": 86400, "oracleKind": "stock-pause-guarded"}
  },
  "pools": [
    {"slug": "mstr-usdg", "base": "MSTR", "quote": "USDG", "hoursPolicy": "equity-hours", "sqrtPriceX96": 6383108975856265909503829325869360, "vaultAllocationCap": 0, "initialLiquidity": {"base": 0, "quote": 0, "slippageBps": 0}},
    {"slug": "coin-usdg", "base": "COIN", "quote": "USDG", "hoursPolicy": "equity-hours", "sqrtPriceX96": 5920739420776831231761784138793803, "vaultAllocationCap": 0, "initialLiquidity": {"base": 0, "quote": 0, "slippageBps": 0}},
    {"slug": "crcl-usdg", "base": "CRCL", "quote": "USDG", "hoursPolicy": "equity-hours", "sqrtPriceX96": 8835031032329992896192695365743527, "vaultAllocationCap": 0, "initialLiquidity": {"base": 0, "quote": 0, "slippageBps": 0}},
    {"slug": "nvda-usdg", "base": "NVDA", "quote": "USDG", "hoursPolicy": "equity-hours", "sqrtPriceX96": 5144125041553721684123073439782017, "vaultAllocationCap": 0, "initialLiquidity": {"base": 0, "quote": 0, "slippageBps": 0}},
    {"slug": "spy-usdg", "base": "SPY", "quote": "USDG", "hoursPolicy": "equity-hours", "sqrtPriceX96": 2206976600149207378450170, "vaultAllocationCap": 0, "initialLiquidity": {"base": 0, "quote": 0, "slippageBps": 0}},
    {"slug": "gld-usdg", "base": "GLD", "quote": "USDG", "hoursPolicy": "equity-hours", "sqrtPriceX96": 4084215853641481822629981452942328, "vaultAllocationCap": 0, "initialLiquidity": {"base": 0, "quote": 0, "slippageBps": 0}},
    {"slug": "aapl-usdg", "base": "AAPL", "quote": "USDG", "hoursPolicy": "equity-hours", "sqrtPriceX96": 4319456416616899974069847959268618, "vaultAllocationCap": 0, "initialLiquidity": {"base": 0, "quote": 0, "slippageBps": 0}},
    {"slug": "tsla-usdg", "base": "TSLA", "quote": "USDG", "hoursPolicy": "equity-hours", "sqrtPriceX96": 1537023393070374292445834, "vaultAllocationCap": 0, "initialLiquidity": {"base": 0, "quote": 0, "slippageBps": 0}},
    {"slug": "mstr-weth", "base": "MSTR", "quote": "WETH", "hoursPolicy": "equity-hours", "sqrtPriceX96": 323485686547320190873736356417, "vaultAllocationCap": 0, "initialLiquidity": {"base": 0, "quote": 0, "slippageBps": 0}},
    {"slug": "coin-weth", "base": "COIN", "quote": "WETH", "hoursPolicy": "equity-hours", "sqrtPriceX96": 300053541877819893380413334588, "vaultAllocationCap": 0, "initialLiquidity": {"base": 0, "quote": 0, "slippageBps": 0}},
    {"slug": "qqq-weth", "base": "QQQ", "quote": "WETH", "hoursPolicy": "equity-hours", "sqrtPriceX96": 146012243954457674283929560983, "vaultAllocationCap": 0, "initialLiquidity": {"base": 0, "quote": 0, "slippageBps": 0}},
    {"slug": "nvda-weth", "base": "NVDA", "quote": "WETH", "hoursPolicy": "equity-hours", "sqrtPriceX96": 260695975432417333585559044047, "vaultAllocationCap": 0, "initialLiquidity": {"base": 0, "quote": 0, "slippageBps": 0}},
    {"slug": "pltr-weth", "base": "PLTR", "quote": "WETH", "hoursPolicy": "equity-hours", "sqrtPriceX96": 288483587334168633672217684361, "vaultAllocationCap": 0, "initialLiquidity": {"base": 0, "quote": 0, "slippageBps": 0}},
    {"slug": "aapl-msft", "base": "AAPL", "quote": "MSFT", "hoursPolicy": "equity-hours", "sqrtPriceX96": 63027714477185317413884166078, "vaultAllocationCap": 0, "safety": {"stabilizationSeconds": 900, "maxOracleSkew": 86400}, "initialLiquidity": {"base": 0, "quote": 0, "slippageBps": 0}},
    {"slug": "spy-nvda", "base": "SPY", "quote": "NVDA", "hoursPolicy": "equity-hours", "sqrtPriceX96": 143294546215263177776136359910, "vaultAllocationCap": 0, "safety": {"stabilizationSeconds": 900, "maxOracleSkew": 86400}, "initialLiquidity": {"base": 0, "quote": 0, "slippageBps": 0}},
    {"slug": "spy-qqq", "base": "SPY", "quote": "QQQ", "hoursPolicy": "equity-hours", "sqrtPriceX96": 80257312007297634271693918154, "vaultAllocationCap": 0, "safety": {"stabilizationSeconds": 900, "maxOracleSkew": 86400}, "initialLiquidity": {"base": 0, "quote": 0, "slippageBps": 0}},
    {"slug": "gld-slv", "base": "GLD", "quote": "SLV", "hoursPolicy": "equity-hours", "sqrtPriceX96": 29990241637532719135628934934, "vaultAllocationCap": 0, "safety": {"stabilizationSeconds": 900, "maxOracleSkew": 86400}, "initialLiquidity": {"base": 0, "quote": 0, "slippageBps": 0}},
    {"slug": "weth-usdg", "base": "WETH", "quote": "USDG", "hoursPolicy": "always-open", "sqrtPriceX96": 4015155724545877127749950, "vaultAllocationCap": 0, "safety": {"stabilizationSeconds": 0, "maxOracleSkew": 0}, "initialLiquidity": {"base": 0, "quote": 0, "slippageBps": 0}}
  ]
}
